city_name,country,hotel_name,booking_url,latitude,longitude,score,description
Aix en Provence,France,Appart'hôtel Odalys City - Aix en Provence Centre Palais des Congrès,https://www.booking.com/hotel/fr/atrium-d-anaite.fr.html?aid=304142&label=gen173nr-10CAQoggJCHnNlYXJjaF9haXggZW4gcHJvdmVuY2UsIGZyYW5jZUgNWARokQGIAQGYATO4ARnIAQzYAQPoAQH4AQGIAgGoAgG4Ativn88GwAIB0gIkM2ZhODg3MGYtMmM0MC00M2NmLTgwMDQtMzA5YjU3Y2EzZWU22AIB4AIB&ucfs=1&arphpl=1&checkin=2026-05-01&checkout=2026-05-08&group_adults=2&req_adults=2&no_rooms=1&group_children=0&req_children=0&hpos=1&hapos=1&sr_order=popularity&srpvid=030a8cece2580838&srepoch=1776801753&all_sr_blocks=5407401_88984661_2_34_0&highlighted_blocks=5407401_88984661_2_34_0&matching_block_id=5407401_88984661_2_34_0&sr_pri_blocks=5407401_88984661_2_34_0__61268&from=searchresults,43.524091009042785,5.4552161693573,8.0,"Situé à Aix-en-Provence, l’Cours Mirabeau, Appart Hotel Odalys City Aix en Provence L’Atrium propose des appartements offrant 1 chambre et des studios indépendants dotés d’une connexion Wi-Fi gratuite. Le centre-ville historique et la gare sont à 10 minutes de marche, tandis que les boutiques du cours Mirabeau sont à 5 minutes à pied.

Les studios et les appartements disposent d’une télévision par câble satellite à écran plat. Leur salle de bains privative comprend une baignoire ou une douche. Leur kitchenette est équipée de plaques de cuisson, d'un micro-ondes et d'un réfrigérateur.

Moyennant un supplément, vous pourrez déguster un petit-déjeuner complet dans la salle prévue à cet effet.

Vous séjournerez à 30 minutes en voiture de la montagne Sainte-Victoire et à 4 minutes à pied du musée Granet. La gare d’Aix-en-Provence se trouve à 10 minutes de marche de l’établissement. L'aéroport de Marseille Provence, quant à lui, est situé à 25 minutes de route. Un parking privé est disponible sur place, moyennant un supplément et sous réserve de disponibilité."
Aix en Provence,France,Renaissance Aix-en-Provence Hotel,https://www.booking.com/hotel/fr/renaissance-aix-en-provence.fr.html?aid=304142&label=gen173nr-10CAQoggJCHnNlYXJjaF9haXggZW4gcHJvdmVuY2UsIGZyYW5jZUgNWARokQGIAQGYATO4ARnIAQzYAQPoAQH4AQGIAgGoAgG4Ativn88GwAIB0gIkM2ZhODg3MGYtMmM0MC00M2NmLTgwMDQtMzA5YjU3Y2EzZWU22AIB4AIB&ucfs=1&arphpl=1&checkin=2026-05-01&checkout=2026-05-08&group_adults=2&req_adults=2&no_rooms=1&group_children=0&req_children=0&hpos=2&hapos=2&sr_order=popularity&srpvid=030a8cece2580838&srepoch=1776801759&all_sr_blocks=57689902_388600791_2_2_0&highlighted_blocks=57689902_388600791_2_2_0&matching_block_id=57689902_388600791_2_2_0&sr_pri_blocks=57689902_388600791_2_2_0__219500&from=searchresults,43.526331235519,5.43796353042126,8.6,"Situé à moins de 10 minutes à pied du centre d'Aix-en-Provence, le Renaissance Aix-en-Provence Hotel propose une réception ouverte 24h/24, des journaux et une connexion Wi-Fi gratuite. Vous bénéficierez d'un accès gratuit au spa doté d'une piscine intérieure chauffée, d'un hammam, d'une salle de sport et de 2 cabines de soins. 

Offrant toutes une vue sur le jardin ou la ville, les chambres spacieuses comprennent une salle de bains privative pourvue d'une baignoire ou d'une douche.

Vous pourrez déguster un petit-déjeuner buffet, américain ou continental. Vous disposerez aussi d'un bistro et d'un bar sur place.

Vous séjournerez à 200 mètres du Grand Théâtre. Par ailleurs, vous aurez la possibilité de jouer au bowling à 1 km et au golf à 3 km ou de pratiquer l'équitation à 1,9 km. Enfin, l’aéroport Marseille-Provence est accessible à 25 minutes en voiture du Renaissance Aix-en-Provence Hotel."
Aix en Provence,France,Domaine de Carraire,https://www.booking.com/hotel/fr/domaine-de-carraire-chez-alphonse.fr.html?aid=304142&label=gen173nr-10CAQoggJCHnNlYXJjaF9haXggZW4gcHJvdmVuY2UsIGZyYW5jZUgNWARokQGIAQGYATO4ARnIAQzYAQPoAQH4AQGIAgGoAgG4Ativn88GwAIB0gIkM2ZhODg3MGYtMmM0MC00M2NmLTgwMDQtMzA5YjU3Y2EzZWU22AIB4AIB&ucfs=1&arphpl=1&checkin=2026-05-01&checkout=2026-05-08&group_adults=2&req_adults=2&no_rooms=1&group_children=0&req_children=0&hpos=3&hapos=3&sr_order=popularity&srpvid=030a8cece2580838&srepoch=1776801759&all_sr_blocks=501592205_175009726_0_0_0&highlighted_blocks=501592205_175009726_0_0_0&matching_block_id=501592205_175009726_0_0_0&sr_pri_blocks=501592205_175009726_0_0_0__84000&from=searchresults,43.5660625,5.3844477,8.5,"L’établissement Domaine de Carraire se trouve à Aix-en-Provence, à 36 km de ce lieu d’intérêt : Gare de Marseille-Saint-Charles. Il propose une piscine extérieure ouverte en saison, un jardin, une terrasse et un parking privé gratuit. Disposant d’une connexion Wi-Fi gratuite, cette maison d'hôtes est à respectivement 37 km et 38 km environ de : Centre commercial Les Terrasses du Port et Métro Vieux-Port. Cet établissement non-fumeurs vous accueille à 36 km de : Métro Joliette.

Les hébergements disposent d’une télévision à écran plat avec les chaînes du câble. Vous bénéficierez d'une machine à café ainsi que d'une salle de bains privative dotée d’une douche et d'articles de toilette gratuits. Certains hébergements comprennent également une cuisine équipée d’un micro-ondes. Des serviettes et du linge de lit sont fournis.

Lors de votre séjour, vous pourrez pratiquer diverses activités à Aix-en-Provence et dans les environs, telles que la randonnée.

Vous séjournerez à respectivement 38 km et 38 km de ces lieux d’intérêt : Musée des Civilisations de l'Europe et de la Méditerranée (MuCEM) et Métro Castellane. L'aéroport le plus proche (Aéroport de Marseille Provence) est à 32 km."
Aix en Provence,France,Hôtel Birdy by Happyculture,https://www.booking.com/hotel/fr/royal-mirabeau.fr.html?aid=304142&label=gen173nr-10CAQoggJCHnNlYXJjaF9haXggZW4gcHJvdmVuY2UsIGZyYW5jZUgNWARokQGIAQGYATO4ARnIAQzYAQPoAQH4AQGIAgGoAgG4Ativn88GwAIB0gIkM2ZhODg3MGYtMmM0MC00M2NmLTgwMDQtMzA5YjU3Y2EzZWU22AIB4AIB&ucfs=1&arphpl=1&checkin=2026-05-01&checkout=2026-05-08&group_adults=2&req_adults=2&no_rooms=1&group_children=0&req_children=0&hpos=4&hapos=4&sr_order=popularity&srpvid=030a8cece2580838&srepoch=1776801759&all_sr_blocks=22737606_91912754_0_2_0&highlighted_blocks=22737606_91912754_0_2_0&matching_block_id=22737606_91912754_0_2_0&sr_pri_blocks=22737606_91912754_0_2_0__98200&from=searchresults,43.48142972107352,5.365614295005798,8.6,"L’Hôtel Birdy by Happyculture se trouve à 10 minutes de route d’Aix-en-Provence, à proximité d’un parcours de golf de 18 trous. L’établissement dispose d’une piscine extérieure et d’une connexion Wi-Fi gratuite dans l’ensemble de ses locaux.

Ces hébergements sont climatisés et équipés d'une télévision à écran plat. Toutes les chambres comprennent une salle de bains privative. Certaines chambres possèdent un balcon ou une terrasse privée.

Le restaurant de l'hôtel est ouvert du dimanche soir au vendredi midi. Vous pourrez également vous détendre autour d’un verre au bar sur place, ouvert de 10h00 à 22h00. L’établissement propose un petit-déjeuner buffet.

Vous trouverez 3 salles de réunion sur place pour organiser des réunions, des ateliers ou des cocktails. Un jardin et une terrasse sont également à votre disposition.

L’Hôtel Birdy by Happyculture est à 6,7 km de la gare TGV de Marseille et à 17 km de l’aéroport de Marseille Provence. Le parking sur place est gratuit."
Aix en Provence,France,Grand Hôtel Roi René Aix - MGallery Collection,https://www.booking.com/hotel/fr/grand-mercure-roi-rene.fr.html?aid=304142&label=gen173nr-10CAQoggJCHnNlYXJjaF9haXggZW4gcHJvdmVuY2UsIGZyYW5jZUgNWARokQGIAQGYATO4ARnIAQzYAQPoAQH4AQGIAgGoAgG4Ativn88GwAIB0gIkM2ZhODg3MGYtMmM0MC00M2NmLTgwMDQtMzA5YjU3Y2EzZWU22AIB4AIB&ucfs=1&arphpl=1&checkin=2026-05-01&checkout=2026-05-08&group_adults=2&req_adults=2&no_rooms=1&group_children=0&req_children=0&hpos=5&hapos=5&sr_order=popularity&srpvid=030a8cece2580838&srepoch=1776801759&all_sr_blocks=5414707_94273308_2_34_0&highlighted_blocks=5414707_94273308_2_34_0&matching_block_id=5414707_94273308_2_34_0&sr_pri_blocks=5414707_94273308_2_34_0__170071&from_sustainable_property_sr=1&from=searchresults,43.52332474147478,5.449725687503815,8.4,"Situé à seulement 5 minutes à pied du cours Mirabeau et du centre-ville d’Aix-en-Provence, le Grand Hôtel Roi René Aix en Provence Centre - MGallery est un établissement 4 étoiles disposant d’une piscine extérieure ouverte en saison, d’avril à fin septembre. Vous pourrez également profiter d’une terrasse, d’une salle de sport et d’une connexion Wi-Fi gratuite.

Affichant une décoration contemporaine, les chambres sont dotées de la climatisation, d’une télévision par satellite à écran plat, d’un minibar et d’un coffre-fort. Les salles de bains privatives sont pourvues d’une baignoire ou d’une douche, de peignoirs, d’un sèche-cheveux, de chaussons et d’articles de toilette gratuits L’Occitane. Toutes les chambres comportent une machine à café Nespresso.

Le restaurant sur place, La Table du Roi, sert une cuisine française traditionnelle. Pendant votre séjour, vous pourrez aussi prendre un verre au bar L’intemporel.

La gare se trouve à 400 mètres du Grand Hôtel Roi René Aix en Provence Centre - MGallery by Sofitel. Un parking privé est disponible, sur demande et moyennant des frais supplémentaires.

L'hôtel fait partie du label « Clef Verte », engagé en faveur d’un tourisme durable pour les restaurants et les hébergements en France."
Paris,France,Magnificient 2 Bedrooms with terrace next to champs-elysées - PC62B,https://www.booking.com/hotel/fr/magnificient-2-bedrooms-with-terrace-next-to-champs-elysees-pc62b.fr.html?aid=304142&label=gen173nr-10CAQoggJCFHNlYXJjaF9wYXJpcywgZnJhbmNlSA1YBGiRAYgBAZgBM7gBGcgBDNgBA-gBAfgBAYgCAagCAbgC0LCfzwbAAgHSAiQyNmM4YmFjZC1lNDUxLTRjYzMtYTZhZi1lNWQ2M2JmNDM5Y2XYAgHgAgE&ucfs=1&arphpl=1&checkin=2026-05-01&checkout=2026-05-08&group_adults=2&req_adults=2&no_rooms=1&group_children=0&req_children=0&hpos=1&hapos=1&sr_order=popularity&srpvid=793c8d281870098c&srepoch=1776801876&all_sr_blocks=1246330701_396880774_2_0_0&highlighted_blocks=1246330701_396880774_2_0_0&matching_block_id=1246330701_396880774_2_0_0&sr_pri_blocks=1246330701_396880774_2_0_0__469930&from=searchresults,48.8694528,2.303809,8.4,"Situé dans le centre de Paris, l’hébergement Magnificient 2 Bedrooms with terrace next to champs-elysées - PC62B possède un jardin, une terrasse et un casino. Il offre une vue sur le jardin. Cet hébergement est installé à 1 km de : Arc de Triomphe. Il comprend une connexion Wi-Fi gratuite et un distributeur de billets.

Cet appartement avec climatisation se compose de 2 chambres, d'un salon, d'une cuisine entièrement équipée avec un réfrigérateur et une machine à café, ainsi que de 2 salles de bains avec une baignoire et un sèche-cheveux. Cet hébergement met à votre disposition des serviettes et du linge de lit.

Vous séjournerez à proximité de ces lieux d’intérêt : Musée de l'Orangerie, Tour Eiffel et Gare Saint-Lazare. L'aéroport le plus proche (Aéroport de Paris - Orly) est à 24 km."
Paris,France,Bradford Elysées - Astotel,https://www.booking.com/hotel/fr/bradfordelysees.fr.html?aid=304142&label=gen173nr-10CAQoggJCFHNlYXJjaF9wYXJpcywgZnJhbmNlSA1YBGiRAYgBAZgBM7gBGcgBDNgBA-gBAfgBAYgCAagCAbgC0LCfzwbAAgHSAiQyNmM4YmFjZC1lNDUxLTRjYzMtYTZhZi1lNWQ2M2JmNDM5Y2XYAgHgAgE&ucfs=1&arphpl=1&checkin=2026-05-01&checkout=2026-05-08&group_adults=2&req_adults=2&no_rooms=1&group_children=0&req_children=0&hpos=2&hapos=2&sr_order=popularity&srpvid=793c8d281870098c&srepoch=1776801876&all_sr_blocks=5090807_91457998_2_2_0&highlighted_blocks=5090807_91457998_2_2_0&matching_block_id=5090807_91457998_2_2_0&sr_pri_blocks=5090807_91457998_2_2_0__182300&from=searchresults,48.87291320304089,2.3081912844827457,9.1,"Occupant un bâtiment haussmannien, le Bradford Elysées - Astotel est un établissement 4 étoiles, installé au cœur de Paris, à proximité des célèbres Champs-Élysées. L’établissement propose des chambres élégantes et une salle de petit-déjeuner avec un toit en verre.

Affichant une décoration classique et élégante, les chambres spacieuses du Bradford Elysées comportent une télévision par câble. Certains logements s’ouvrent sur un balcon. Les chambres comprennent également un minibar approvisionné en boissons sans alcool gratuites. Les salles de bains privatives sont pourvues de carrelage et d’un lavabo en marbre.

Un petit-déjeuner buffet est servi chaque matin dans la salle à manger lumineuse de l’hôtel. Vous pourrez également déguster votre petit-déjeuner dans l’intimité de votre chambre. De l’après-midi jusqu’à tard en soirée, des boissons sans alcool et des collations vous seront servies gratuitement dans le hall de l’hôtel. Vous pourrez bénéficier de ce service dans tous les autres établissements Astotel de Paris et déguster une boisson ou une collation gratuitement.

Le Bradford Elysées est implanté à 5 minutes à pied de la station de métro Franklin D. Roosevelt, qui dessert directement le jardin des Tuileries, le musée du Louvre et la place de la Bastille. Vous bénéficierez gratuitement d’une connexion Wi-Fi dans l’ensemble de l’établissement et toutes les chambres sont desservies par un ascenseur. Après une journée de visites, vous pourrez vous détendre dans le salon de l’hôtel."
Paris,France,Moxy Paris Bastille,https://www.booking.com/hotel/fr/moxy-paris-bastille.fr.html?aid=304142&label=gen173nr-10CAQoggJCFHNlYXJjaF9wYXJpcywgZnJhbmNlSA1YBGiRAYgBAZgBM7gBGcgBDNgBA-gBAfgBAYgCAagCAbgC0LCfzwbAAgHSAiQyNmM4YmFjZC1lNDUxLTRjYzMtYTZhZi1lNWQ2M2JmNDM5Y2XYAgHgAgE&ucfs=1&arphpl=1&checkin=2026-05-01&checkout=2026-05-08&group_adults=2&req_adults=2&no_rooms=1&group_children=0&req_children=0&hpos=3&hapos=3&sr_order=popularity&srpvid=793c8d281870098c&srepoch=1776801876&all_sr_blocks=21963912_94350844_0_34_0&highlighted_blocks=21963912_94350844_0_34_0&matching_block_id=21963912_94350844_0_34_0&sr_pri_blocks=21963912_94350844_0_34_0__124470&from_sustainable_property_sr=1&from=searchresults,48.85752847347896,2.369939535856247,8.0,"Le Moxy Paris Bastille est un hôtel situé entre les quartiers de la Bastille et du Marais. Il propose des chambres dotées d'une connexion Wi-Fi haut débit gratuite et de ports de chargement USB.

Elles sont également équipées d'une télévision connectée haute définition et d'un système audio de haute qualité.

Vous trouverez un point de restauration rapide sur place.

Le Moxy Paris Bastille se situe à 90 mètres de la station de métro Bréguet-Sabin et à quelques minutes de marche du quartier animé du Marais qui compte de nombreux restaurants, cafés et magasins."
Paris,France,Hotel Joke - Astotel,https://www.booking.com/hotel/fr/joke-astotel.fr.html?aid=304142&label=gen173nr-10CAQoggJCFHNlYXJjaF9wYXJpcywgZnJhbmNlSA1YBGiRAYgBAZgBM7gBGcgBDNgBA-gBAfgBAYgCAagCAbgC0LCfzwbAAgHSAiQyNmM4YmFjZC1lNDUxLTRjYzMtYTZhZi1lNWQ2M2JmNDM5Y2XYAgHgAgE&ucfs=1&arphpl=1&checkin=2026-05-01&checkout=2026-05-08&group_adults=2&req_adults=2&no_rooms=1&group_children=0&req_children=0&hpos=4&hapos=4&sr_order=popularity&srpvid=793c8d281870098c&srepoch=1776801876&all_sr_blocks=134376802_89504560_0_2_0&highlighted_blocks=134376802_89504560_0_2_0&matching_block_id=134376802_89504560_0_2_0&sr_pri_blocks=134376802_89504560_0_2_0__135800&from=searchresults,48.8824459,2.3318647999999484,9.1,"L’établissement Hotel Joke - Astotel bénéficie d’un emplacement attractif dans le quartier 9e arr. De Paris, à respectivement 1,1 km, 1,4 km et 700 mètres de ces lieux d’intérêt : Gare Saint-Lazare, Opéra Garnier et Salle de spectacles La Cigale. Cet hôtel 3 étoiles propose une réception ouverte 24h/24, un service de concierge et une connexion Wi-Fi gratuite. Cet établissement non-fumeurs se situe à 500 mètres de : Métro Pigalle.

Les hébergements comprennent la climatisation, un bureau, une bouilloire, un minibar, un coffre-fort, une télévision à écran plat et une salle de bains privative dotée d’une baignoire ou une douche. Des serviettes et du linge de lit sont fournis.

Un petit-déjeuner buffet, continental ou végétarien est servi sur place.

Vous séjournerez à respectivement 2,6 km et 2,7 km de ces lieux d’intérêt : Gare du Nord et Musée de l'Orangerie. L'aéroport le plus proche (Aéroport de Paris - Orly) est à 19 km."
Paris,France,Hotel Mercure La Sorbonne Saint-Germain-des-Prés,https://www.booking.com/hotel/fr/paris-la-sorbonne.fr.html?aid=304142&label=gen173nr-10CAQoggJCFHNlYXJjaF9wYXJpcywgZnJhbmNlSA1YBGiRAYgBAZgBM7gBGcgBDNgBA-gBAfgBAYgCAagCAbgC0LCfzwbAAgHSAiQyNmM4YmFjZC1lNDUxLTRjYzMtYTZhZi1lNWQ2M2JmNDM5Y2XYAgHgAgE&ucfs=1&arphpl=1&checkin=2026-05-01&checkout=2026-05-08&group_adults=2&req_adults=2&no_rooms=1&group_children=0&req_children=0&hpos=5&hapos=5&sr_order=popularity&srpvid=793c8d281870098c&srepoch=1776801876&all_sr_blocks=5710301_93700747_2_2_0&highlighted_blocks=5710301_93700747_2_2_0&matching_block_id=5710301_93700747_2_2_0&sr_pri_blocks=5710301_93700747_2_2_0__207432&from_sustainable_property_sr=1&from=searchresults,48.84941277105371,2.343228757381439,8.7,"Cet hôtel Mercure est situé en face de l'Université de Paris La Sorbonne. Il propose un hébergement climatisé, à 2 minutes à pied seulement du Panthéon et du Jardin du Luxembourg.

Toutes les chambres sont dotées d'une salle de bains privative et d'une télévision satellite.

Un petit déjeuner buffet est servi tous les jours et la propriété assure un service de blanchisserie et de nettoyage à sec. Profitez de la réception ouverte 24 heures sur 24.

L'hôtel se trouve à 5 minutes à pied de la gare RER Luxembourg, qui vous conduira directement à la Gare du Nord et à l'aéroport Roissy Charles de Gaulle. La station de métro Cluny-La Sorbonne est à 300 mètres."
Besancon,France,ibis Styles Besançon,https://www.booking.com/hotel/fr/besancon.fr.html?aid=304142&label=gen173nr-10CAQoggJCF3NlYXJjaF9iZXNhbmNvbiwgZnJhbmNlSA1YBGiRAYgBAZgBM7gBGcgBDNgBA-gBAfgBAYgCAagCAbgC7bCfzwbAAgHSAiQ1ODk5ZTRkZS1lYjMyLTRhNWItYjk0YS0zNTQzYThjZjljN2PYAgHgAgE&ucfs=1&arphpl=1&checkin=2026-05-01&checkout=2026-05-08&group_adults=2&req_adults=2&no_rooms=1&group_children=0&req_children=0&hpos=1&hapos=1&sr_order=popularity&srpvid=743d8d36cbb108e5&srepoch=1776801905&all_sr_blocks=5726203_94276162_2_33_0&highlighted_blocks=5726203_94276162_2_33_0&matching_block_id=5726203_94276162_2_33_0&sr_pri_blocks=5726203_94276162_2_33_0__68331&from_sustainable_property_sr=1&from=searchresults,47.2542534551454,6.021639704704285,7.8,"Idéalement situé dans un parc, l'hôtel ibis Styles Besançon se trouve à 15 minutes à pied de la gare TGV et du centre de Besançon. Il met à votre disposition une piscine extérieure dotée d'une terrasse bien exposée ainsi qu'une connexion Wi-Fi gratuite.

Ses chambres climatisées et spacieuses affichent une décoration de style contemporain. Elles comprennent également une télévision à écran LCD et une connexion Wi-Fi gratuite.

L'établissement vous proposera chaque matin un petit-déjeuner buffet. Vous pourrez siroter un verre au bar de l'hôtel ou dîner dans son restaurant. Une aire de jeux pour enfants et des salles de réunion sont également disponibles sur place.

L'hôtel met à votre disposition un parking privé gratuit ainsi qu'une réception ouverte 24h/24. Il se situe à 10 minutes en voiture du parc des expositions Micropolis et à seulement 3,7 km de la citadelle de Besançonet, site classé au patrimoine mondial de l'UNESCO."
Besancon,France,B&B HOTEL Besançon Valentin,https://www.booking.com/hotel/fr/b-amp-b-besancon-valentin.fr.html?aid=304142&label=gen173nr-10CAQoggJCF3NlYXJjaF9iZXNhbmNvbiwgZnJhbmNlSA1YBGiRAYgBAZgBM7gBGcgBDNgBA-gBAfgBAYgCAagCAbgC7bCfzwbAAgHSAiQ1ODk5ZTRkZS1lYjMyLTRhNWItYjk0YS0zNTQzYThjZjljN2PYAgHgAgE&ucfs=1&arphpl=1&checkin=2026-05-01&checkout=2026-05-08&group_adults=2&req_adults=2&no_rooms=1&group_children=0&req_children=0&hpos=2&hapos=2&sr_order=popularity&srpvid=743d8d36cbb108e5&srepoch=1776801905&all_sr_blocks=1069610302_379474316_2_2_0&highlighted_blocks=1069610302_379474316_2_2_0&matching_block_id=1069610302_379474316_2_2_0&sr_pri_blocks=1069610302_379474316_2_2_0__69300&from_sustainable_property_sr=1&from=searchresults,,,8.4,
Besancon,France,Hôtel Siatel Besançon Chateaufarine,https://www.booking.com/hotel/fr/siatel-chateaufarine.fr.html?aid=304142&label=gen173nr-10CAQoggJCF3NlYXJjaF9iZXNhbmNvbiwgZnJhbmNlSA1YBGiRAYgBAZgBM7gBGcgBDNgBA-gBAfgBAYgCAagCAbgC7bCfzwbAAgHSAiQ1ODk5ZTRkZS1lYjMyLTRhNWItYjk0YS0zNTQzYThjZjljN2PYAgHgAgE&ucfs=1&arphpl=1&checkin=2026-05-01&checkout=2026-05-08&group_adults=2&req_adults=2&no_rooms=1&group_children=0&req_children=0&hpos=3&hapos=3&sr_order=popularity&srpvid=743d8d36cbb108e5&srepoch=1776801905&all_sr_blocks=39121409_106995398_2_2_0&highlighted_blocks=39121409_106995398_2_2_0&matching_block_id=39121409_106995398_2_2_0&sr_pri_blocks=39121409_106995398_2_2_0__34510&from=searchresults,47.21613221566271,5.941833257675171,7.7,"Cet hôtel est situé à 7,5 km du centre de Besançon en Franche-Comté et propose une connexion Wi-Fi gratuite. Vous pourrez vous détendre sur la terrasse ou jouer au billard au bar sur place. La climatisation est disponible dans les parties communes.

Chaque chambre insonorisée comprend une télévision à écran plat et un téléphone. Toutes les chambres de l'Hôtel Siatel Besançon Chateaufarine comprennent un bureau et une salle de bains privative avec sèche-cheveux. Certaines disposent d'une connexion Wi-Fi haut débit et de la climatisation.

Un parking privé gratuit est disponible sur place et la gare de Besançon-Viotte se trouve à 7,7 km. L'hôtel se trouve à 8,2 km du musée des beaux-arts et d'archéologie et à 6,5 km de l'autoroute A36."
Besancon,France,Hôtel de Paris,https://www.booking.com/hotel/fr/de-paris-besanasson.fr.html?aid=304142&label=gen173nr-10CAQoggJCF3NlYXJjaF9iZXNhbmNvbiwgZnJhbmNlSA1YBGiRAYgBAZgBM7gBGcgBDNgBA-gBAfgBAYgCAagCAbgC7bCfzwbAAgHSAiQ1ODk5ZTRkZS1lYjMyLTRhNWItYjk0YS0zNTQzYThjZjljN2PYAgHgAgE&ucfs=1&arphpl=1&checkin=2026-05-01&checkout=2026-05-08&group_adults=2&req_adults=2&no_rooms=1&group_children=0&req_children=0&hpos=4&hapos=4&sr_order=popularity&srpvid=743d8d36cbb108e5&srepoch=1776801905&all_sr_blocks=46971602_363647665_0_2_0&highlighted_blocks=46971602_363647665_0_2_0&matching_block_id=46971602_363647665_0_2_0&sr_pri_blocks=46971602_363647665_0_2_0__70245&from=searchresults,47.23856536577556,6.025325059890747,8.6,"Welcome to the Hôtel de Paris, ideally located in the heart of Besançon. Enjoy a peaceful and comfortable stay in a prime location, close to major tourist attractions such as the Vauban Citadel, the Astronomical Clock, the Museum of Time, and the Museum of Fine Arts. We welcome you 24/7 and offer rooms equipped with air conditioning and free Wi-Fi. A generous breakfast buffet and secure private parking (at an additional cost) are also available. Numerous restaurants are within walking distance.

The hotel is just 1 km from Viotte train station (tram available) and 12 km from the Besançon Franche-Comté TGV station.

The entire team at the Hôtel de Paris is at your disposal to offer you a pleasant stay in Besançon."
Besancon,France,Hôtel Restaurant Spa Le Sauvage,https://www.booking.com/hotel/fr/ho-tel-le-sauvage-besanasson.fr.html?aid=304142&label=gen173nr-10CAQoggJCF3NlYXJjaF9iZXNhbmNvbiwgZnJhbmNlSA1YBGiRAYgBAZgBM7gBGcgBDNgBA-gBAfgBAYgCAagCAbgC7bCfzwbAAgHSAiQ1ODk5ZTRkZS1lYjMyLTRhNWItYjk0YS0zNTQzYThjZjljN2PYAgHgAgE&ucfs=1&arphpl=1&checkin=2026-05-01&checkout=2026-05-08&group_adults=2&req_adults=2&no_rooms=1&group_children=0&req_children=0&hpos=5&hapos=5&sr_order=popularity&srpvid=743d8d36cbb108e5&srepoch=1776801905&all_sr_blocks=38019401_229950838_2_2_0&highlighted_blocks=38019401_229950838_2_2_0&matching_block_id=38019401_229950838_2_2_0&sr_pri_blocks=38019401_229950838_2_2_0__112900&from=searchresults,47.23171766809705,6.027591526508331,8.6,"L’Hôtel Restaurant Spa Le Sauvage vous accueille dans l’ancien monastère des Clarisses, dans le quartier historique de Besançon, à 500 mètres des anciens contreforts de la citadelle. Cet établissement offre des vues sur le parc bordé d’arbres, les remparts médiévaux, la ville et la vallée du Doubs.

Revêtues de parquet, toutes les chambres sont dotées d’une salle de bains privative pourvue d’une baignoire ou d’une douche. Les hébergements comprennent également une télévision à écran plat, un téléphone et un bureau. Certains logements offrent une vue sur le jardin et la ville.

Le petit-déjeuner est servi chaque matin dans le coin repas, sur la terrasse, ou peut être apporté dans votre chambre sur demande. Vous pourrez également vous détendre sur la terrasse orientée à l'ouest avec une boisson commandée au bar. Vous pourrez accéder au spa sur réservation et moyennant des frais supplémentaires.

Vous séjournerez à 10 minutes à pied du musée du Temps et à seulement 2 km de la gare ferroviaire de Besançon-Viotte. Vous trouverez des commerces et restaurants à moins de 10 minutes de marche. Un parking privé est accessible moyennant un supplément. Vous bénéficierez gratuitement d’une connexion Wi-Fi."
